{
	"$schema": "http://json-schema.org/draft-04/schema#",
	"additionalProperties": true,
	"dependencies": {
		"name": [
			"faction_code",
			"type_code"
		]
	},
	"description": "JSON Schema for a Marvel Champions card — derived from Card.orm.yml",
	"properties": {
		"alt_art": {
			"type": "boolean"
		},
		"attack": {
			"oneOf": [
				{
					"minimum": -1,
					"type": "integer"
				},
				{
					"type": "null"
				}
			]
		},
		"attack_cost": {
			"minimum": 0,
			"type": "integer"
		},
		"attack_star": {
			"type": "boolean"
		},
		"back_flavor": {
			"minLength": 1,
			"type": "string"
		},
		"back_link": {
			"minLength": 1,
			"type": "string"
		},
		"back_name": {
			"minLength": 1,
			"type": "string"
		},
		"back_text": {
			"minLength": 1,
			"type": "string"
		},
		"base_threat": {
			"oneOf": [
				{
					"minimum": -1,
					"type": "integer"
				},
				{
					"type": "null"
				}
			]
		},
		"base_threat_fixed": {
			"type": "boolean"
		},
		"base_threat_per_group": {
			"type": "boolean"
		},
		"base_threat_star": {
			"type": "boolean"
		},
		"boost": {
			"minimum": 1,
			"type": "integer"
		},
		"boost_star": {
			"type": "boolean"
		},
		"code": {
			"pattern": "^[0-9]{5,6}[a-z]?$",
			"type": "string"
		},
		"cost": {
			"oneOf": [
				{
					"minimum": -1,
					"type": "integer"
				},
				{
					"type": "null"
				}
			]
		},
		"cost_per_hero": {
			"type": "boolean"
		},
		"creator": {
			"minLength": 1,
			"type": "string"
		},
		"deck_limit": {
			"minimum": 1,
			"type": "integer"
		},
		"deck_options": {
			"items": {
				"properties": {
					"faction": {
						"items": {
							"minLength": 1,
							"type": "string"
						},
						"minItems": 1,
						"type": "array"
					},
					"limit": {
						"minimum": 1,
						"type": "integer"
					},
					"multi_aspect": {
						"type": "boolean"
					},
					"name_limit": {
						"minimum": 1,
						"type": "integer"
					},
					"per_faction": {
						"type": "boolean"
					},
					"resource": {
						"items": {
							"minLength": 1,
							"type": "string"
						},
						"minItems": 1,
						"type": "array"
					},
					"trait": {
						"items": {
							"minLength": 1,
							"type": "string"
						},
						"minItems": 1,
						"type": "array"
					},
					"type": {
						"items": {
							"minLength": 1,
							"type": "string"
						},
						"minItems": 1,
						"type": "array"
					},
					"use_deck_limit": {
						"type": "boolean"
					}
				},
				"type": "object"
			},
			"minItems": 1,
			"type": "array"
		},
		"deck_requirements": {
			"items": {
				"properties": {
					"aspects": {
						"minimum": 1,
						"type": "integer"
					},
					"limit": {
						"minimum": 1,
						"type": "integer"
					}
				},
				"type": "object"
			},
			"minItems": 1,
			"type": "array"
		},
		"defense": {
			"oneOf": [
				{
					"minimum": -1,
					"type": "integer"
				},
				{
					"type": "null"
				}
			]
		},
		"defense_star": {
			"type": "boolean"
		},
		"double_sided": {
			"type": "boolean"
		},
		"duplicate_of": {
			"pattern": "^[0-9a-z]{5}[0-9a-z]?$",
			"type": "string"
		},
		"errata": {
			"minLength": 1,
			"type": "string"
		},
		"escalation_threat": {
			"oneOf": [
				{
					"minimum": -1,
					"type": "integer"
				},
				{
					"type": "null"
				}
			]
		},
		"escalation_threat_fixed": {
			"type": "boolean"
		},
		"escalation_threat_star": {
			"type": "boolean"
		},
		"expansions_needed": {
			"minLength": 1,
			"type": "string"
		},
		"faction2_code": {
			"minLength": 1,
			"type": "string"
		},
		"faction_code": {
			"minLength": 1,
			"type": "string"
		},
		"flavor": {
			"minLength": 0,
			"type": "string"
		},
		"hand_size": {
			"minimum": 1,
			"type": "integer"
		},
		"health": {
			"oneOf": [
				{
					"minimum": -1,
					"type": "integer"
				},
				{
					"type": "null"
				}
			]
		},
		"health_per_group": {
			"type": "boolean"
		},
		"health_per_hero": {
			"type": "boolean"
		},
		"health_star": {
			"type": "boolean"
		},
		"hidden": {
			"type": "boolean"
		},
		"illustrator": {
			"pattern": ".*",
			"type": "string"
		},
		"is_unique": {
			"oneOf": [
				{
					"type": "boolean"
				},
				{
					"type": "null"
				}
			]
		},
		"meta": {
			"type": "object"
		},
		"multiverse_of": {
			"pattern": "^[0-9]{5,6}[a-z]?$",
			"type": "string"
		},
		"name": {
			"minLength": 1,
			"type": "string"
		},
		"octgn_id": {
			"minLength": 1,
			"type": "string"
		},
		"pack_code": {
			"maxLength": 255,
			"minLength": 2,
			"type": "string"
		},
		"permanent": {
			"type": "boolean"
		},
		"position": {
			"minimum": 1,
			"type": "integer"
		},
		"quantity": {
			"minimum": 1,
			"type": "integer"
		},
		"recover": {
			"minimum": 0,
			"type": "integer"
		},
		"recover_star": {
			"type": "boolean"
		},
		"resource_energy": {
			"minimum": 0,
			"type": "integer"
		},
		"resource_mental": {
			"minimum": 0,
			"type": "integer"
		},
		"resource_physical": {
			"minimum": 0,
			"type": "integer"
		},
		"resource_wild": {
			"minimum": 0,
			"type": "integer"
		},
		"restrictions": {
			"minLength": 1,
			"type": "string"
		},
		"scheme": {
			"oneOf": [
				{
					"minimum": -1,
					"type": "integer"
				},
				{
					"type": "null"
				}
			]
		},
		"scheme_acceleration": {
			"minimum": 1,
			"type": "integer"
		},
		"scheme_amplify": {
			"minimum": 1,
			"type": "integer"
		},
		"scheme_crisis": {
			"minimum": 1,
			"type": "integer"
		},
		"scheme_hazard": {
			"minimum": 1,
			"type": "integer"
		},
		"scheme_star": {
			"type": "boolean"
		},
		"set_code": {
			"minLength": 1,
			"type": "string"
		},
		"set_position": {
			"minimum": 1,
			"type": "integer"
		},
		"stage": {
			"minLength": 1,
			"type": "string"
		},
		"subname": {
			"minLength": 1,
			"type": "string"
		},
		"text": {
			"minLength": 1,
			"type": "string"
		},
		"threat": {
			"oneOf": [
				{
					"minimum": -1,
					"type": "integer"
				},
				{
					"type": "null"
				}
			]
		},
		"threat_fixed": {
			"type": "boolean"
		},
		"threat_per_group": {
			"type": "boolean"
		},
		"threat_star": {
			"type": "boolean"
		},
		"thwart": {
			"oneOf": [
				{
					"minimum": -1,
					"type": "integer"
				},
				{
					"type": "null"
				}
			]
		},
		"thwart_cost": {
			"minimum": 0,
			"type": "integer"
		},
		"thwart_star": {
			"type": "boolean"
		},
		"traits": {
			"minLength": 0,
			"type": "string"
		},
		"type_code": {
			"minLength": 1,
			"type": "string"
		}
	},
	"required": [
		"code",
		"pack_code",
		"position",
		"quantity"
	],
	"type": "object"
}
