[
    {
        "code": "60501b",
        "faction_code": "hero",
        "hand_size": 6,
        "health": 12,
        "hidden": true,
        "is_unique": true,
        "name": "Laura Kinney",
        "octgn_id": "a609960e-607c-5889-921f-5e725e000001",
        "pack_code": "weapon_hex_by_merlin",
        "position": 1,
        "quantity": 1,
        "recover": 6,
        "set_code": "weapon_hex_by_merlin",
        "text": "<i>Hex Chaos</i> — <b>Setup</b>: Find and put into play Chaos Magic.\n<b>Action</b>: shuffle a [[spell ]]card from your discard pile into your deck. (Limit once per round.)",
        "traits": "Mutant. Mystic. Warp.",
        "type_code": "alter_ego"
    },
    {
        "attack": 1,
        "back_link": "60501b",
        "code": "60501a",
        "defense": 2,
        "faction_code": "hero",
        "hand_size": 5,
        "health": 12,
        "is_unique": true,
        "meta": {
            "colors": [
                "#010101",
                "#cf2413",
                "#dd882d",
                "#201b1c"
            ],
            "offset": "-35px -33px"
        },
        "name": "Weapon Hex",
        "octgn_id": "a609960e-607c-5889-921f-5e725e000001",
        "pack_code": "weapon_hex_by_merlin",
        "position": 1,
        "quantity": 1,
        "set_code": "weapon_hex_by_merlin",
        "text": "<i>Living Weapon </i>—<i> </i> <b>Response</b>: After you play a [[spell ]]event, ready Weapon Hex and discard X cards from the top of the encounter deck, where X is equal to the printed cost of that event (Limit once per phase.)",
        "thwart": 2,
        "traits": "Mystic. Warp.",
        "type_code": "hero"
    },
    {
        "code": "60502",
        "deck_limit": 1,
        "faction_code": "hero",
        "is_unique": true,
        "name": "Chaos Magic",
        "octgn_id": "a609960e-607c-5889-921f-5e725e000002",
        "pack_code": "weapon_hex_by_merlin",
        "permanent": true,
        "position": 2,
        "quantity": 1,
        "resource_physical": 1,
        "set_code": "weapon_hex_by_merlin",
        "set_position": 1,
        "text": "Permanent. Setup.\n<b>Hero Action</b>: Exhaust Chaos Magic → search your deck for a [[spell ]]card and add it to your hand. Then discard 3 cards from the top of the encounter deck.",
        "traits": "Skill.",
        "type_code": "upgrade"
    },
    {
        "attack": 1,
        "attack_cost": 1,
        "code": "60503",
        "cost": 2,
        "deck_limit": 1,
        "faction_code": "hero",
        "health": 2,
        "is_unique": true,
        "name": "Speed Weasel",
        "octgn_id": "a609960e-607c-5889-921f-5e725e000003",
        "pack_code": "weapon_hex_by_merlin",
        "position": 3,
        "quantity": 1,
        "resource_wild": 1,
        "set_code": "weapon_hex_by_merlin",
        "set_position": 2,
        "subname": "gavrill kinney",
        "text": "<b>Hero Response</b>: After Speed Weasel activates, ready Speed Weasel and Weapon Hex (limit once per round).\n<i>“My name is Speed Weasel!!!”</i>",
        "thwart": 1,
        "thwart_cost": 1,
        "traits": "Warp.",
        "type_code": "ally"
    },
    {
        "code": "60504",
        "cost": 1,
        "deck_limit": 2,
        "faction_code": "hero",
        "name": "Special Target",
        "octgn_id": "a609960e-607c-5889-921f-5e725e000004",
        "pack_code": "weapon_hex_by_merlin",
        "position": 4,
        "quantity": 2,
        "resource_mental": 1,
        "set_code": "weapon_hex_by_merlin",
        "set_position": 3,
        "text": "<b>Hero Action</b>: Deal X damage to an enemy, where X is equal to your ATK.\n<i>“An Hex marks the spot.”</i>",
        "traits": "Spell.",
        "type_code": "event"
    },
    {
        "code": "60506",
        "cost": 1,
        "deck_limit": 2,
        "faction_code": "hero",
        "name": "From Nothing",
        "octgn_id": "a609960e-607c-5889-921f-5e725e000006",
        "pack_code": "weapon_hex_by_merlin",
        "position": 5,
        "quantity": 2,
        "resource_mental": 1,
        "set_code": "weapon_hex_by_merlin",
        "set_position": 5,
        "text": "<b>Hero Action</b>: Remove X threat from a scheme, where X is equal to your THW.\n<i>“You're nothing.”</i>",
        "traits": "Spell.",
        "type_code": "event"
    },
    {
        "code": "60508",
        "cost": 3,
        "deck_limit": 2,
        "faction_code": "hero",
        "name": "Death Ray",
        "octgn_id": "a609960e-607c-5889-921f-5e725e000008",
        "pack_code": "weapon_hex_by_merlin",
        "position": 6,
        "quantity": 2,
        "resource_physical": 1,
        "set_code": "weapon_hex_by_merlin",
        "set_position": 7,
        "text": "<b>Hero Action</b>: Deal 7 damage to an enemy. If you discard 1 card from the top of the encounter deck, deal those damage among enemies in play.\n“Don't threaten my sister!”\n<i>\n</i>",
        "traits": "Spell.",
        "type_code": "event"
    },
    {
        "code": "60510",
        "cost": 1,
        "deck_limit": 1,
        "faction_code": "hero",
        "name": "Magic Protection",
        "octgn_id": "a609960e-607c-5889-921f-5e725e000010",
        "pack_code": "weapon_hex_by_merlin",
        "position": 7,
        "quantity": 1,
        "resource_energy": 1,
        "set_code": "weapon_hex_by_merlin",
        "set_position": 9,
        "text": "<b>Hero Interrupt</b>: When a friendly character would take any amount of damage, prevent 5 of that damage.",
        "traits": "Spell.",
        "type_code": "event"
    },
    {
        "code": "60511",
        "cost": 1,
        "deck_limit": 2,
        "faction_code": "hero",
        "name": "Warp Reality",
        "octgn_id": "a609960e-607c-5889-921f-5e725e000011",
        "pack_code": "weapon_hex_by_merlin",
        "position": 8,
        "quantity": 2,
        "resource_physical": 1,
        "set_code": "weapon_hex_by_merlin",
        "set_position": 10,
        "text": "<b>Hero Interrupt</b>: When an encounter card is revealed from the encounter deck, cancel all of its effects and discard it. Discard cards from the top of the encounter deck equal to the number of boost icons on that card.",
        "traits": "Spell.",
        "type_code": "event"
    },
    {
        "code": "60513",
        "cost": 1,
        "deck_limit": 2,
        "faction_code": "hero",
        "name": "Regenerative Longevity",
        "octgn_id": "a609960e-607c-5889-921f-5e725e000013",
        "pack_code": "weapon_hex_by_merlin",
        "position": 9,
        "quantity": 2,
        "resource_physical": 1,
        "set_code": "weapon_hex_by_merlin",
        "set_position": 12,
        "text": "<b>Action</b>: Heal 4 damage from among your identity and Speed Weasel.",
        "traits": "Superpower.",
        "type_code": "event"
    },
    {
        "code": "60515",
        "cost": 1,
        "deck_limit": 1,
        "faction_code": "hero",
        "name": "Chaotic Energy",
        "octgn_id": "a609960e-607c-5889-921f-5e725e000015",
        "pack_code": "weapon_hex_by_merlin",
        "position": 10,
        "quantity": 1,
        "resource_energy": 1,
        "set_code": "weapon_hex_by_merlin",
        "set_position": 14,
        "text": "<b>Resource</b>: Exhaust Chaotic Energy → generate a [wild] resource for a [[spell ]]event.",
        "traits": "Item.",
        "type_code": "upgrade"
    },
    {
        "code": "60516",
        "deck_limit": 1,
        "faction_code": "hero",
        "name": "Magical Healing",
        "octgn_id": "a609960e-607c-5889-921f-5e725e000016",
        "pack_code": "weapon_hex_by_merlin",
        "position": 11,
        "quantity": 1,
        "resource_energy": 1,
        "set_code": "weapon_hex_by_merlin",
        "set_position": 15,
        "text": "<b>Interrupt</b>: When Weapon Hex would be defeated, set her hit point dial to 6 instead. Then, discard this card.",
        "traits": "Skill. Spell.",
        "type_code": "upgrade"
    },
    {
        "code": "60517",
        "cost": 2,
        "deck_limit": 1,
        "faction_code": "hero",
        "is_unique": true,
        "name": "Weapon Hex's Claws",
        "octgn_id": "a609960e-607c-5889-921f-5e725e000017",
        "pack_code": "weapon_hex_by_merlin",
        "position": 12,
        "quantity": 1,
        "resource_physical": 1,
        "set_code": "weapon_hex_by_merlin",
        "set_position": 16,
        "text": "Restricted.\nWeapon Hex gets +2 ATK and her basic attacks gain piercing.",
        "traits": "Weapon.",
        "type_code": "upgrade"
    }
]
