[
	{
		"code": "204001b",
		"faction_code": "hero",
		"hand_size": 6,
		"health": 10,
		"hidden": true,
		"is_unique": true,
		"name": "Karnak Mander-Azur",
		"octgn_id": "7f9b9b69-72b7-477d-9891-b4856c040001",
		"pack_code": "Karnak_by_1-2-punchboard",
		"position": 1,
		"quantity": 1,
		"recover": 3,
		"set_code": "Karnak_by_1-2-punchboard",
		"text": "<i>Meditation</i> — <b>Response</b>: After Karnak recovers, search your deck and discard pile for an [[ATTACK]], [[THWART]], or [[DEFENSE]] event. Add that card to your hand. If you searched your deck, shuffle it. (Limit once per phase.)",
		"traits": "Inhuman.",
		"type_code": "alter_ego"
	},
	{
		"attack": 2,
		"back_link": "204001b",
		"code": "204001a",
		"defense": 1,
		"faction_code": "hero",
		"hand_size": 5,
		"health": 10,
		"is_unique": true,
		"meta": {
			"colors": [
				"#03a81d",
				"#585858",
				"#ffffff",
				"#fffffd"
			],
			"offset": "-38px -33px"
		},
		"name": "Karnak",
		"octgn_id": "7f9b9b69-72b7-477d-9891-b4856c040001",
		"pack_code": "Karnak_by_1-2-punchboard",
		"position": 1,
		"quantity": 1,
		"set_code": "Karnak_by_1-2-punchboard",
		"text": "<i>Flaw in All Things</i> — <b>Response</b>: After Karnak attacks or thwarts and defeats an enemy or side scheme without dealing excess damage or removing excess threat, deal 1 damage to an enemy and ready Karnak. (Limit twice per round.)",
		"thwart": 2,
		"traits": "Inhuman.",
		"type_code": "hero"
	},
	{
		"attack": 2,
		"attack_cost": 1,
		"code": "204002",
		"cost": 3,
		"deck_limit": 1,
		"faction_code": "hero",
		"health": 3,
		"is_unique": true,
		"name": "Gorgon Petragon",
		"octgn_id": "7f9b9b69-72b7-477d-9891-b4856c040002",
		"pack_code": "Karnak_by_1-2-punchboard",
		"position": 2,
		"quantity": 1,
		"resource_energy": 1,
		"set_code": "Karnak_by_1-2-punchboard",
		"set_position": 1,
		"text": "<b>Response</b>: After Gorgon Petragon attacks, deal 1 damage to each enemy.\n<i>“I have devoted my entire life to honing the warrior's craft. I have sacrificed everything fighting for my people's future!”</i>",
		"thwart": 1,
		"thwart_cost": 1,
		"traits": "Inhuman.",
		"type_code": "ally"
	},
	{
		"code": "204003",
		"cost": 0,
		"deck_limit": 4,
		"faction_code": "hero",
		"name": "Excess and Restraint",
		"octgn_id": "7f9b9b69-72b7-477d-9891-b4856c040003",
		"pack_code": "Karnak_by_1-2-punchboard",
		"position": 3,
		"quantity": 4,
		"resource_physical": 1,
		"set_code": "Karnak_by_1-2-punchboard",
		"set_position": 2,
		"text": "<b>Hero Interrupt</b>: When Karnak attacks, increase or decrease (you choose) the damage that attack deals by 1.\n<b>Hero Interrupt</b>: When Karnak thwarts, increase or decrease (you choose) the threat that thwart removes by 1.",
		"traits": "Attack. Skill. Thwart.",
		"type_code": "event"
	},
	{
		"code": "204004",
		"cost": 3,
		"deck_limit": 2,
		"faction_code": "hero",
		"name": "Disarm",
		"octgn_id": "7f9b9b69-72b7-477d-9891-b4856c040004",
		"pack_code": "Karnak_by_1-2-punchboard",
		"position": 4,
		"quantity": 2,
		"resource_mental": 1,
		"set_code": "Karnak_by_1-2-punchboard",
		"set_position": 6,
		"text": "<b>Hero Action</b> <i>(thwart)</i>: Remove 3 threat from a scheme and discard an [[ARMOR]], [[TECH]], or [[WEAPON]] attachment from an enemy. If no attachment was discarded this way, confuse the villain instead.\n<i>“In time, all we rely on will shatter and fall.”</i>",
		"traits": "Skill. Thwart.",
		"type_code": "event"
	},
	{
		"code": "204005",
		"cost": 2,
		"deck_limit": 2,
		"faction_code": "hero",
		"name": "Peerless Defense",
		"octgn_id": "7f9b9b69-72b7-477d-9891-b4856c040005",
		"pack_code": "Karnak_by_1-2-punchboard",
		"position": 5,
		"quantity": 2,
		"resource_mental": 1,
		"set_code": "Karnak_by_1-2-punchboard",
		"set_position": 8,
		"text": "<b>Hero Interrupt</b> <i>(thwart)</i>: When you would take any amount of damage, discard Peerless Defense → prevent up to 3 of that damage. Remove threat from a scheme equal to the amount of damage prevented this way.",
		"traits": "Preparation. Skill. Thwart.",
		"type_code": "upgrade"
	},
	{
		"code": "204006",
		"cost": 1,
		"deck_limit": 2,
		"faction_code": "hero",
		"name": "Probing for Weakness",
		"octgn_id": "7f9b9b69-72b7-477d-9891-b4856c040006",
		"pack_code": "Karnak_by_1-2-punchboard",
		"position": 6,
		"quantity": 2,
		"resource_energy": 1,
		"set_code": "Karnak_by_1-2-punchboard",
		"set_position": 10,
		"text": "<b>Hero Action</b> <i>(attack)</i>: Deal 1 damage to an enemy. This attack gains piercing. If this attack discarded a tough status card, deal another 3 damage to that enemy.\n<i>“Where is the flaw?”</i>",
		"traits": "Attack. Skill.",
		"type_code": "event"
	},
	{
		"code": "204007",
		"deck_limit": 2,
		"faction_code": "hero",
		"name": "Martial Training",
		"octgn_id": "7f9b9b69-72b7-477d-9891-b4856c040007",
		"pack_code": "Karnak_by_1-2-punchboard",
		"position": 7,
		"quantity": 2,
		"resource_wild": 1,
		"set_code": "Karnak_by_1-2-punchboard",
		"set_position": 12,
		"text": "If Karnak has attacked or thwarted this turn, double the number of resources this card generates.",
		"type_code": "resource"
	},
	{
		"code": "204008",
		"cost": 2,
		"deck_limit": 1,
		"faction_code": "hero",
		"name": "Tower of Wisdom",
		"octgn_id": "7f9b9b69-72b7-477d-9891-b4856c040008",
		"pack_code": "Karnak_by_1-2-punchboard",
		"position": 8,
		"quantity": 1,
		"resource_wild": 1,
		"set_code": "Karnak_by_1-2-punchboard",
		"set_position": 14,
		"text": "Karnak Mander-Azur gets +2 REC.\n<b>Alter-Ego Action</b>: Exhaust Tower of Wisdom → remove 1 threat from a scheme.",
		"traits": "Inhuman. Location.",
		"type_code": "support"
	},
	{
		"code": "204009",
		"cost": 4,
		"deck_limit": 1,
		"faction_code": "hero",
		"name": "The Shatterer",
		"octgn_id": "7f9b9b69-72b7-477d-9891-b4856c040009",
		"pack_code": "Karnak_by_1-2-punchboard",
		"position": 9,
		"quantity": 1,
		"resource_physical": 1,
		"set_code": "Karnak_by_1-2-punchboard",
		"set_position": 15,
		"text": "<b>Hero Action</b> <i>(attack)</i>: Deal between 1 and 6 damage to an enemy. If you defeat a minion engaged with a player, stun the villain and each minion engaged with that player.\n<i>“It is my discipline to be able to sense the weakest spot in any object -- And my power to shatter it.”</i>",
		"traits": "Attack. Skill.",
		"type_code": "event"
	}
]
