[
    {
        "boost": 2,
        "code": "203612",
        "faction_code": "encounter",
        "name": "Relationship Breakdown",
        "octgn_id": "2ff1dcda-c503-479c-9a9e-22f9ba036012",
        "pack_code": "luke_cage_by_rainy",
        "position": 12,
        "quantity": 1,
        "set_code": "luke_cage_by_rainy",
        "text": "You may flip to alter-ego form.\nWhile this card is in play, flip your hero-specific ally and supports facedown.\n<b>Alter-Ego Action</b>: Exhaust Luke Cage → remove Relationship Breakdown from the game and flip face-up each card that was flipped facedown by this obligation.",
        "type_code": "obligation"
    },
    {
        "base_threat": 2,
        "boost": 2,
        "code": "203613",
        "faction_code": "encounter",
        "name": "A New Kingpin",
        "octgn_id": "2ff1dcda-c503-479c-9a9e-22f9ba036013",
        "pack_code": "luke_cage_by_rainy",
        "position": 13,
        "quantity": 1,
        "set_code": "luke_cage_by_rainy_nemesis",
        "set_position": 1,
        "text": "<i>Diamondback is flooding the street with a new drug that gives superpowers, aiming to become the new Kingpin of Crime by hooking up other criminals.\n</i><b>When Revealed</b>: Give the villain 1 facedown boost card and a tough status card.\n[acceleration]",
        "type_code": "side_scheme"
    },
    {
        "attack": 2,
        "attack_star": true,
        "boost": 2,
        "code": "203614",
        "faction_code": "encounter",
        "flavor": "If you fall in line behind me, I can hook you up.",
        "health": 5,
        "is_unique": true,
        "name": "Diamondback",
        "octgn_id": "2ff1dcda-c503-479c-9a9e-22f9ba036014",
        "pack_code": "luke_cage_by_rainy",
        "position": 14,
        "quantity": 1,
        "scheme": 2,
        "scheme_star": true,
        "set_code": "luke_cage_by_rainy_nemesis",
        "set_position": 2,
        "text": "Toughness.\n[star] <b>Forced Interrupt</b>: When Diamondback would activate, seek an attachment from the encounter deck and reveal it.\n<i>(Luke Cage's nemesis minion.)</i>",
        "traits": "Criminal.",
        "type_code": "minion"
    },
    {
        "boost": 3,
        "code": "203615",
        "faction_code": "encounter",
        "name": "Jacked-Up",
        "octgn_id": "2ff1dcda-c503-479c-9a9e-22f9ba036015",
        "pack_code": "luke_cage_by_rainy",
        "position": 15,
        "quantity": 1,
        "set_code": "luke_cage_by_rainy_nemesis",
        "set_position": 3,
        "text": "Attach to Diamondback, otherwise attach to the minion with the most remaining hit points and give them a tough status card. If you cannot attach this card, this card gains surge.\nAttached character gets +2 hit points.",
        "traits": "Condition. Superpower.",
        "type_code": "attachment"
    },
    {
        "boost": 1,
        "code": "203616",
        "faction_code": "encounter",
        "name": "Diamond",
        "octgn_id": "2ff1dcda-c503-479c-9a9e-22f9ba036016",
        "pack_code": "luke_cage_by_rainy",
        "position": 16,
        "quantity": 2,
        "set_code": "luke_cage_by_rainy_nemesis",
        "set_position": 4,
        "text": "Attach to the minion with the most remaining hit points without another copy of Diamond attached and give them a tough status card. If you cannot attach this card, this card gains surge.\n<i>Diamond produces a second-long surge of energy in its consumer, followed by an unstoppable rush that lasts for hours.</i>",
        "traits": "Drug.",
        "type_code": "attachment"
    }
]
