[
	{
		"boost": 2,
		"code": "48026",
		"faction_code": "encounter",
		"illustrator": "Bruno Frenda",
		"name": "Crisis of Faith",
		"octgn_id": "65f91d01-99db-4c7e-814f-28ddf0048026",
		"pack_code": "ncrawler",
		"position": 26,
		"quantity": 1,
		"set_code": "nightcrawler",
		"text": "<b><i>Give to the Kurt Wagner player.</i></b>\nYou may flip to alter-ego form. Choose:\n• Exhaust Kurt Wagner → remove Crisis of Faith from the game.\n• Discard each [[Attack]] and [[Defense]] event from your hand. Discard this obligation.",
		"type_code": "obligation"
	},
	{
		"attack": 3,
		"boost_star": true,
		"code": "48027",
		"faction_code": "encounter",
		"health": 3,
		"is_unique": true,
		"name": "Azazel",
		"octgn_id": "65f91d01-99db-4c7e-814f-28ddf0048027",
		"pack_code": "ncrawler",
		"position": 27,
		"quantity": 1,
		"scheme": 2,
		"set_code": "nightcrawler_nemesis",
		"set_position": 1,
		"text": "Quickstrike.\nAzazel cannot have upgrades attached.\n<hr />\n[star] <b>Boost</b>: Deal Azazel to the Kurt Wagner player as a facedown encounter card.",
		"traits": "Elite. Neyaphem.",
		"type_code": "minion"
	},
	{
		"base_threat": 5,
		"base_threat_fixed": true,
		"boost": 3,
		"code": "48028",
		"faction_code": "encounter",
		"flavor": "\"All of this could be yours, if you'd only join me!\"—Azazel",
		"illustrator": "Allie Preswick",
		"name": "Brimstone Dimension",
		"octgn_id": "65f91d01-99db-4c7e-814f-28ddf0048028",
		"pack_code": "ncrawler",
		"position": 28,
		"quantity": 1,
		"set_code": "nightcrawler_nemesis",
		"set_position": 2,
		"text": "<b>When Defeated</b>: The player who defeated this scheme finds Azazel and deals him to themself as a facedown encounter card.",
		"type_code": "side_scheme"
	},
	{
		"attack": 1,
		"attack_star": true,
		"boost": 2,
		"code": "48029",
		"faction_code": "encounter",
		"name": "Azazel's Sword",
		"octgn_id": "65f91d01-99db-4c7e-814f-28ddf0048029",
		"pack_code": "ncrawler",
		"position": 29,
		"quantity": 1,
		"set_code": "nightcrawler_nemesis",
		"set_position": 3,
		"text": "Attach to Azazel. Otherwise, attach to the villain.\n[star] Attached enemy's attacks gain piercing.\n<b>Hero Response</b>: After attached enemy attacks you, discard 1 random card from your hand → discard this card.",
		"traits": "Weapon.",
		"type_code": "attachment"
	},
	{
		"boost": 1,
		"code": "48030",
		"faction_code": "encounter",
		"flavor": "Azazel delights in frustrating his opponents by teleporting in and out of combat.",
		"name": "Brimstone Strike",
		"octgn_id": "65f91d01-99db-4c7e-814f-28ddf0048030",
		"pack_code": "ncrawler",
		"position": 30,
		"quantity": 2,
		"set_code": "nightcrawler_nemesis",
		"set_position": 4,
		"text": "<b>When Revealed (Alter-Ego)</b>: Find Azazel and reveal him. He schemes.\n<b>When Revealed (Hero)</b>: Find Azazel and reveal him.",
		"type_code": "treachery"
	},
	{
		"base_threat": 2,
		"base_threat_fixed": true,
		"boost": 2,
		"code": "48033",
		"faction_code": "encounter",
		"name": "The Crazy Gang",
		"octgn_id": "65f91d01-99db-4c7e-814f-28ddf0048033",
		"pack_code": "ncrawler",
		"position": 33,
		"quantity": 1,
		"scheme_acceleration": 1,
		"set_code": "crazy_gang",
		"set_position": 1,
		"text": "<b>Forced Response</b>: After a non-[[Elite]] minion schemes against a player, deal that minion to that player as a facedown encounter card. Then, if there is more than 1 player in the game, pass that facedown encounter card to the next player.",
		"type_code": "side_scheme"
	},
	{
		"attack": 1,
		"boost": 3,
		"code": "48034",
		"faction_code": "encounter",
		"flavor": "\"Off with his head!\"",
		"health": 4,
		"is_unique": true,
		"name": "Queen of Hearts",
		"octgn_id": "65f91d01-99db-4c7e-814f-28ddf0048034",
		"pack_code": "ncrawler",
		"position": 34,
		"quantity": 1,
		"scheme": 0,
		"set_code": "crazy_gang",
		"set_position": 2,
		"text": "<b>When Revealed</b>: Search the encounter deck and discard pile for The Crazy Gang side scheme and reveal it. If it is already in play, deal yourself a facedown encounter card. <i>(Shuffle.)</i>",
		"traits": "Criminal. Queen.",
		"type_code": "minion"
	},
	{
		"attack": 1,
		"boost": 1,
		"code": "48035",
		"faction_code": "encounter",
		"flavor": "\"I'll kick you in the face with fun!\"",
		"health": 5,
		"is_unique": true,
		"name": "Jester",
		"octgn_id": "65f91d01-99db-4c7e-814f-28ddf0048035",
		"pack_code": "ncrawler",
		"position": 35,
		"quantity": 1,
		"scheme": 0,
		"set_code": "crazy_gang",
		"set_position": 3,
		"text": "<b>When Revealed</b>: You are confused. If you were already confused, discard a support you control.",
		"traits": "Criminal.",
		"type_code": "minion"
	},
	{
		"attack": 2,
		"boost": 2,
		"code": "48036",
		"faction_code": "encounter",
		"flavor": "The Queen of Hearts keeps him busy with her catchphrase.",
		"health": 4,
		"is_unique": true,
		"name": "Executioner",
		"octgn_id": "65f91d01-99db-4c7e-814f-28ddf0048036",
		"pack_code": "ncrawler",
		"position": 36,
		"quantity": 1,
		"scheme": 0,
		"set_code": "crazy_gang",
		"set_position": 4,
		"text": "<b>When Revealed</b>: Executioner attacks the friendly character with the fewest remaining hit points. If this attack defeats an ally, remove that ally from the game.",
		"traits": "Criminal.",
		"type_code": "minion"
	},
	{
		"attack": 2,
		"boost": 1,
		"code": "48037",
		"errata": "Removed the star icon (★) from the boost field. (RRG)",
		"faction_code": "encounter",
		"flavor": "\"Hyuk hyuk hyuk!\"",
		"health": 6,
		"is_unique": true,
		"name": "Tweedledope",
		"octgn_id": "65f91d01-99db-4c7e-814f-28ddf0048037",
		"pack_code": "ncrawler",
		"position": 37,
		"quantity": 1,
		"scheme": 0,
		"set_code": "crazy_gang",
		"set_position": 5,
		"text": "<b>When Revealed</b>: You are stunned. If you were already stunned, discard an upgrade you control.",
		"traits": "Brute. Criminal.",
		"type_code": "minion"
	},
	{
		"boost": 1,
		"code": "48038",
		"faction_code": "encounter",
		"flavor": "It's basically all she ever says.",
		"name": "\"Off with His Head!\"",
		"octgn_id": "65f91d01-99db-4c7e-814f-28ddf0048038",
		"pack_code": "ncrawler",
		"position": 38,
		"quantity": 1,
		"set_code": "crazy_gang",
		"set_position": 6,
		"text": "<b>When Revealed</b>: Each minion activates against the player it is engaged with. If no minion activates this way, discard cards from the top of the encounter deck until a minion is discarded and reveal that minion.",
		"type_code": "treachery"
	}
]
