[
    {
        "code": "205601b",
        "faction_code": "hero",
        "hand_size": 6,
        "health": 12,
        "hidden": true,
        "is_unique": true,
        "name": "James Howlett",
        "octgn_id": "85ef87e7-7618-4420-b85f-fdf2bd056001",
        "pack_code": "old_man_logan_by_nugget",
        "position": 1,
        "quantity": 1,
        "recover": 4,
        "set_code": "old_man_logan_by_nugget",
        "text": "<b>Setup</b>: Search your deck, hand and discard pile for Wolverine's Claws and put it into play under your control.\n<i>Healing Factor</i> — <b>Action</b>: Remove 1 wound counter from the Old and Tired upgrade. (Limit once per round.)",
        "traits": "Mutant.",
        "type_code": "alter_ego"
    },
    {
        "attack": 2,
        "back_link": "205601b",
        "code": "205601a",
        "defense": 1,
        "errata": "Traits have been changed from \"[[Mutant]]. [[X-Man]]\" to \"[[X-Men]]\" (MC4DB)",
        "faction_code": "hero",
        "flavor": "\"Every time I start to think things won't go bad.\"",
        "hand_size": 5,
        "health": 12,
        "is_unique": true,
        "meta": {
            "colors": [
                "#645866",
                "#6f3d24",
                "#371b05",
                "#95a5a6"
            ],
            "offset": "-35px -33px"
        },
        "name": "Old Man Logan",
        "octgn_id": "85ef87e7-7618-4420-b85f-fdf2bd056001",
        "pack_code": "old_man_logan_by_nugget",
        "position": 1,
        "quantity": 1,
        "set_code": "old_man_logan_by_nugget",
        "text": "<i>Berserker</i> — <b>Action</b>: Place 1 wound counter on the Old and Tired upgrade. Old Man Logan gets +1 THW, +1 ATK and +1 DEF until the end of the round. (Limit once per round.)",
        "thwart": 1,
        "traits": "X-Men.",
        "type_code": "hero"
    },
    {
        "code": "205602",
        "cost": null,
        "deck_limit": 1,
        "faction_code": "hero",
        "name": "Old and Tired",
        "octgn_id": "85ef87e7-7618-4420-b85f-fdf2bd056002",
        "pack_code": "old_man_logan_by_nugget",
        "permanent": true,
        "position": 2,
        "quantity": 1,
        "set_code": "old_man_logan_by_nugget",
        "set_position": 1,
        "text": "Permanent. Setup.\nYou get -1 hit point for each wound counter here.\nWhile there are 6 or more wound counters here, you get +1 hand size.",
        "traits": "Condition.",
        "type_code": "upgrade"
    },
    {
        "code": "205603",
        "cost": 2,
        "deck_limit": 1,
        "faction_code": "hero",
        "is_unique": true,
        "name": "Wolverine's Claws",
        "octgn_id": "85ef87e7-7618-4420-b85f-fdf2bd056003",
        "pack_code": "old_man_logan_by_nugget",
        "position": 3,
        "quantity": 1,
        "resource_physical": 1,
        "set_code": "old_man_logan_by_nugget",
        "set_position": 2,
        "text": "<b>Interrupt</b>: When you attack, exhaust Wolverine's Claws → increase the damage that attack deals by 1 for each wound counter on Old and Tired (max 3 increase in damage). This attack gains piercing. Place 1 wound counter on Old and Tired.",
        "traits": "Weapon. Superpower.",
        "type_code": "upgrade"
    },
    {
        "code": "205604",
        "cost": 0,
        "deck_limit": 2,
        "faction_code": "hero",
        "flavor": "\"I let myself become chaos. Madness. Death.\" — Old Man Logan",
        "name": "Blind Rage",
        "octgn_id": "85ef87e7-7618-4420-b85f-fdf2bd056004",
        "pack_code": "old_man_logan_by_nugget",
        "position": 4,
        "quantity": 2,
        "resource_physical": 1,
        "set_code": "old_man_logan_by_nugget",
        "set_position": 3,
        "text": "<b>Hero Resource</b>: Exhaust Blind Rage → Place 1 wound counter on Old and Tired. Generate a [wild] resource.",
        "traits": "Condition.",
        "type_code": "upgrade"
    },
    {
        "code": "205605",
        "cost": 2,
        "deck_limit": 1,
        "faction_code": "hero",
        "name": "Adamantium Skeleton",
        "octgn_id": "85ef87e7-7618-4420-b85f-fdf2bd056005",
        "pack_code": "old_man_logan_by_nugget",
        "position": 5,
        "quantity": 1,
        "resource_energy": 1,
        "set_code": "old_man_logan_by_nugget",
        "set_position": 5,
        "text": "Old Man Logan gets +1 DEF.\n<b>Interrupt</b>: When a wound counter would be placed on Old and Tired, exhaust Adamantium Skeleton instead.",
        "traits": "Armor.",
        "type_code": "upgrade"
    },
    {
        "code": "205606",
        "cost": 2,
        "deck_limit": 1,
        "faction_code": "hero",
        "flavor": "\"This is what old is. Confusion, aches and pains.\" — Old Man Logan",
        "name": "Enhanced Healing Factor",
        "octgn_id": "85ef87e7-7618-4420-b85f-fdf2bd056006",
        "pack_code": "old_man_logan_by_nugget",
        "position": 6,
        "quantity": 1,
        "resource_energy": 1,
        "set_code": "old_man_logan_by_nugget",
        "set_position": 6,
        "text": "<b>Interrupt</b>: When you would be defeated, remove each wound counter from Old and Tired instead. Then, discard Enhanced Healing Factor.",
        "traits": "Preparation. Superpower.",
        "type_code": "upgrade"
    },
    {
        "attack": 2,
        "attack_cost": 1,
        "code": "205607",
        "cost": 3,
        "deck_limit": 1,
        "faction_code": "hero",
        "health": 3,
        "is_unique": true,
        "name": "Old Man Hawkeye",
        "octgn_id": "85ef87e7-7618-4420-b85f-fdf2bd056007",
        "pack_code": "old_man_logan_by_nugget",
        "position": 7,
        "quantity": 1,
        "resource_wild": 1,
        "set_code": "old_man_logan_by_nugget",
        "set_position": 7,
        "text": "Old Man Hawkeye enters play with 2 arrow counters on him.\n<b>Response</b>: After a minion engages you, remove 1 arrow counter from Old Man Hawkeye → deal 4 damage to that minion.",
        "thwart": 2,
        "thwart_cost": 1,
        "traits": "Avenger.",
        "type_code": "ally"
    },
    {
        "code": "205608",
        "cost": 1,
        "deck_limit": 2,
        "faction_code": "hero",
        "flavor": "SNIKT!",
        "name": "Savage Stab",
        "octgn_id": "85ef87e7-7618-4420-b85f-fdf2bd056008",
        "pack_code": "old_man_logan_by_nugget",
        "position": 8,
        "quantity": 2,
        "resource_physical": 1,
        "set_code": "old_man_logan_by_nugget",
        "set_position": 8,
        "text": "<b>Hero Action</b> <i>(attack)</i>: Place 1 wound counter on Old and Tired. Deal 3 damage to an enemy. If you paid for this card using a [physical] resource, ready Wolverine's Claws.",
        "traits": "Attack.",
        "type_code": "event"
    },
    {
        "code": "205609",
        "cost": 0,
        "deck_limit": 2,
        "faction_code": "hero",
        "name": "Unfazed",
        "octgn_id": "85ef87e7-7618-4420-b85f-fdf2bd056010",
        "pack_code": "old_man_logan_by_nugget",
        "position": 10,
        "quantity": 2,
        "resource_energy": 1,
        "set_code": "old_man_logan_by_nugget",
        "set_position": 10,
        "text": "<b>Interrupt</b>: When you would take any amount of damage from an attack, prevent 1 of that damage for each wound counter on Old and Tired. Place 1 wound counter on Old and Tired.",
        "traits": "Defense.",
        "type_code": "event"
    },
    {
        "code": "205610",
        "cost": 3,
        "deck_limit": 2,
        "faction_code": "hero",
        "name": "Vicious Animal",
        "octgn_id": "85ef87e7-7618-4420-b85f-fdf2bd056012",
        "pack_code": "old_man_logan_by_nugget",
        "position": 12,
        "quantity": 2,
        "resource_mental": 1,
        "set_code": "old_man_logan_by_nugget",
        "set_position": 12,
        "text": "<b>Hero Action</b> <i>(attack)</i>: Deal 2 damage to an enemy for each wound counter on Old and Tired (max 8 damage). You may divide the damage dealt by this attack among enemies as you choose. If you paid for this card using a [physical] resource, you may place a wound counter on Old and Tired.",
        "traits": "Attack.",
        "type_code": "event"
    },
    {
        "code": "205611",
        "cost": 2,
        "deck_limit": 2,
        "faction_code": "hero",
        "name": "Skilled Tracker",
        "octgn_id": "85ef87e7-7618-4420-b85f-fdf2bd056014",
        "pack_code": "old_man_logan_by_nugget",
        "position": 14,
        "quantity": 2,
        "resource_mental": 1,
        "set_code": "old_man_logan_by_nugget",
        "set_position": 14,
        "text": "<b>Action</b> <i>(thwart)</i>: Remove 1 threat from a scheme for each wound counter on Old and Tired (max 4 threat). If you paid for this card using a [mental] resource, you may remove a wound counter from Old and Tired.",
        "traits": "Skill. Thwart.",
        "type_code": "event"
    }
]
