[
    {
        "boost": 2,
        "code": "201017",
        "faction_code": "encounter",
        "name": "Stranger in This Reality",
        "octgn_id": "381bd788-111a-5f4f-a3eb-bcb150000017",
        "pack_code": "blink_by_kajislav",
        "position": 10,
        "quantity": 1,
        "set_code": "blink_by_kajislav",
        "text": "You may flip to alter-ego form. Choose:\nExhaust Clarice Ferguson → remove Stranger in This Reality from the game.\nDiscard each [[portal]] upgrade from play. If no [[portal]] upgrade was discarded this way, this card gains surge. Discard this obligation.",
        "type_code": "obligation"
    },
    {
        "attack": 0,
        "attack_star": true,
        "boost": 2,
        "code": "201018",
        "faction_code": "encounter",
        "health": 1,
        "is_unique": true,
        "name": "Timebroker",
        "octgn_id": "381bd788-111a-5f4f-a3eb-bcb150000018",
        "pack_code": "blink_by_kajislav",
        "position": 11,
        "quantity": 1,
        "scheme": 2,
        "scheme_star": true,
        "set_code": "blink_by_kajislav_nemesis",
        "set_position": 1,
        "text": "Timebroker cannot take damage. [star] <b>Forced Response</b>: After Timebroker activates, place 2 threat on the Damaged Reality side scheme.<b>\nForced Response</b>: After Timebroker enters play, find the Damaged Reality side scheme and reveal it.\n<i>(Blink's nemesis minion.)\n</i>",
        "traits": "Illusion.",
        "type_code": "minion"
    },
    {
        "base_threat": 2,
        "base_threat_fixed": true,
        "boost": 2,
        "code": "201019",
        "faction_code": "encounter",
        "name": "Damaged Reality",
        "octgn_id": "381bd788-111a-5f4f-a3eb-bcb150000019",
        "pack_code": "blink_by_kajislav",
        "position": 12,
        "quantity": 1,
        "set_code": "blink_by_kajislav_nemesis",
        "set_position": 2,
        "text": "<i>Timebreakers had accidentally damaged many realities across the Multiverse and tricked heroes into fixing their mistake.</i>\n<b>When Revealed</b>: Place 1 additional threat here for each upgrade in play. Then, discard an upgrade you control.\n<b>When Defeated</b>: Discard Timebroker.\n[crisis]\n [star] <b>Boost</b>: Reveal this card.",
        "type_code": "side_scheme"
    },
    {
        "boost": 1,
        "code": "201020",
        "faction_code": "encounter",
        "name": "Timebreakers",
        "octgn_id": "381bd788-111a-5f4f-a3eb-bcb150000020",
        "pack_code": "blink_by_kajislav",
        "position": 13,
        "quantity": 3,
        "set_code": "blink_by_kajislav_nemesis",
        "set_position": 3,
        "text": "<b>When Revealed</b>: Search the encounter deck and discard pile for Timebroker and reveal him. <i>(Shuffle.)</i> If Timebroker does not enter play this way, this card gains surge.\n<i>\"Must we really sacrifice a reality just to teach them a lesson?\" —Timebreakers </i>",
        "type_code": "treachery"
    }
]
