[
	{
		"boost": 2,
		"code": "206211",
		"faction_code": "encounter",
		"name": "One Too Many Voices",
		"octgn_id": "0c714380-7fb9-4a28-9c0f-872b09062011",
		"pack_code": "venompool_by_cptscorp",
		"position": 11,
		"quantity": 1,
		"set_code": "venompool_by_cptscorp",
		"text": "You must flip to alter-ego form. Choose:\nExhaust Wade Wilson → remove One Too Many Voices from the game.\nDiscard Klyntar Suit. If Klyntar Suit was not discarded this way, this card gains surge. Discard this obligation.",
		"type_code": "obligation"
	},
	{
		"base_threat": 2,
		"boost": 2,
		"boost_star": true,
		"code": "206212",
		"faction_code": "encounter",
		"name": "Shocking Entrance",
		"octgn_id": "0c714380-7fb9-4a28-9c0f-872b09062012",
		"pack_code": "venompool_by_cptscorp",
		"position": 12,
		"quantity": 1,
		"set_code": "venompool_by_cptscorp_nemesis",
		"set_position": 1,
		"text": "<i>\"Surrender the Klyntar.\" -Killer Thrill</i><b>\nWhen Revealed</b>: Deal 3 indirect damage to the first player.\n[hazard]\n<b>\t\t Boost</b>: Deal 1 indirect damage to the first player.",
		"type_code": "side_scheme"
	},
	{
		"attack": 2,
		"attack_star": true,
		"boost": 2,
		"code": "206213",
		"faction_code": "encounter",
		"health": 5,
		"is_unique": true,
		"name": "Killer Thrill",
		"octgn_id": "0c714380-7fb9-4a28-9c0f-872b09062013",
		"pack_code": "venompool_by_cptscorp",
		"position": 13,
		"quantity": 1,
		"scheme": 2,
		"set_code": "venompool_by_cptscorp_nemesis",
		"set_position": 2,
		"text": "[star] Killer Thrill gets +1 ATK for each adrenaline counter on her.\n<b>Forced Interrupt</b>: When the player phase ends, put 1 adrenaline counter on Killer Thrill. Then, if there are 2 or more adrenaline counters on her, remove them all and she activates.\n<i>(Venompool's nemesis minion.)</i>",
		"traits": "Alien. Bounty Hunter.",
		"type_code": "minion"
	},
	{
		"attack": 1,
		"attack_star": true,
		"boost": 1,
		"boost_star": true,
		"code": "206214",
		"faction_code": "encounter",
		"health": 2,
		"is_unique": true,
		"name": "Coldwar",
		"octgn_id": "0c714380-7fb9-4a28-9c0f-872b09062014",
		"pack_code": "venompool_by_cptscorp",
		"position": 14,
		"quantity": 1,
		"scheme": 1,
		"set_code": "venompool_by_cptscorp_nemesis",
		"set_position": 3,
		"text": "Quickstrike. <i>(After this minion engages your hero, it attacks you.)</i> [star] While Killer Thrill is in play, Coldwar gets +1 ATK.\n<b> Boost</b>: After this activation, deal this card to yourself as a facedown encounter card.",
		"traits": "Alien. Bounty Hunter.",
		"type_code": "minion"
	},
	{
		"attack": 1,
		"boost": 1,
		"boost_star": true,
		"code": "206215",
		"faction_code": "encounter",
		"health": 2,
		"is_unique": true,
		"name": "Guzz",
		"octgn_id": "0c714380-7fb9-4a28-9c0f-872b09062015",
		"pack_code": "venompool_by_cptscorp",
		"position": 15,
		"quantity": 1,
		"scheme": 1,
		"scheme_star": true,
		"set_code": "venompool_by_cptscorp_nemesis",
		"set_position": 4,
		"text": "Plotting. <i>(After this minion engages you, it schemes.)</i> [star] While Killer Thrill is in play, Guzz gets +1 SCH.\n<b> Boost</b>: After this activation, deal this card to yourself as a facedown encounter card.",
		"traits": "Alien. Bounty Hunter.",
		"type_code": "minion"
	},
	{
		"boost": 3,
		"code": "206216",
		"faction_code": "encounter",
		"name": "Psyche Warp",
		"octgn_id": "0c714380-7fb9-4a28-9c0f-872b09062016",
		"pack_code": "venompool_by_cptscorp",
		"position": 16,
		"quantity": 1,
		"set_code": "venompool_by_cptscorp_nemesis",
		"set_position": 5,
		"text": "<b>When Revealed</b>: You take X damage where X is equal to the ATK of the ally with the highest printed ATK. Discard that ally. If no damage was taken this way, this card gains surge.",
		"type_code": "treachery"
	}
]
