[
	{
		"boost": 2,
		"code": "201517",
		"faction_code": "encounter",
		"name": "Identity Crisis",
		"octgn_id": "a4082154-3c42-520c-ade7-5ee1ec000017",
		"pack_code": "ms_marvel_by_cptscorp_&_rycoran",
		"position": 13,
		"quantity": 1,
		"set_code": "ms_marvel_by_cptscorp_&_rycoran",
		"text": "You may flip to alter-ego form. Choose:\nExhaust Carol Danvers → remove Identity Crisis from the game.\nDiscard 1 [[persona]] support you control. If no support was discarded this way, this card gains surge. Discard this obligation.",
		"type_code": "obligation"
	},
	{
		"base_threat": 4,
		"base_threat_fixed": true,
		"boost": 3,
		"code": "201518",
		"faction_code": "encounter",
		"name": "Rogue Rivalry",
		"octgn_id": "a4082154-3c42-520c-ade7-5ee1ec000018",
		"pack_code": "ms_marvel_by_cptscorp_&_rycoran",
		"position": 14,
		"quantity": 1,
		"set_code": "ms_marvel_by_cptscorp_&_rycoran_nemesis",
		"set_position": 1,
		"text": "<i>Ms. Marvel has been targeted by Mystique. Acting impulsively, Rogue has decided to take matters into her own hands.</i><b>\nForced Response</b>: After the villain phase begins, each player discards a random card from their hand.\n[crisis]",
		"type_code": "side_scheme"
	},
	{
		"attack": 3,
		"attack_star": true,
		"boost": 2,
		"code": "201519",
		"faction_code": "encounter",
		"health": 6,
		"is_unique": true,
		"name": "Rogue",
		"octgn_id": "a4082154-3c42-520c-ade7-5ee1ec000019",
		"pack_code": "ms_marvel_by_cptscorp_&_rycoran",
		"position": 15,
		"quantity": 1,
		"scheme": 1,
		"set_code": "ms_marvel_by_cptscorp_&_rycoran_nemesis",
		"set_position": 2,
		"text": "Guard. Teamwork ([[brotherhood of mutants]]). Toughness.\n[star] <b>Forced Response</b>: After Rogue attacks you, discard a [energy] resource \tfrom your hand, if able.\n<i>(Ms. Marvel's nemesis minion.)</i>",
		"traits": "Brotherhood Of Mutants. Elite.",
		"type_code": "minion"
	},
	{
		"attack": 2,
		"boost": 1,
		"boost_star": true,
		"code": "201520",
		"faction_code": "encounter",
		"health": 5,
		"is_unique": true,
		"name": "Mystique",
		"octgn_id": "a4082154-3c42-520c-ade7-5ee1ec000020",
		"pack_code": "ms_marvel_by_cptscorp_&_rycoran",
		"position": 16,
		"quantity": 1,
		"scheme": 2,
		"set_code": "ms_marvel_by_cptscorp_&_rycoran_nemesis",
		"set_position": 3,
		"text": "Patrol. Teamwork ([[brotherhood of mutants]]).\n<b>When Defeated</b>: Choose to either spend a [mental] resource or confuse your identity.\t\t\t\t\t\t\t\t\n [star] <b>Boost</b>: You are confused.",
		"traits": "Brotherhood Of Mutants. Elite.",
		"type_code": "minion"
	},
	{
		"boost": 2,
		"code": "201521",
		"faction_code": "encounter",
		"name": "Rogue Assault",
		"octgn_id": "a4082154-3c42-520c-ade7-5ee1ec000021",
		"pack_code": "ms_marvel_by_cptscorp_&_rycoran",
		"position": 17,
		"quantity": 1,
		"set_code": "ms_marvel_by_cptscorp_&_rycoran_nemesis",
		"set_position": 4,
		"text": "<b>When Revealed (Alter-Ego)</b>: Place threat on the main scheme equal to the total number of [energy] resources in your hand.\n<b>When Revealed (Hero)</b>: Take indirect damage equal to the total number of [energy] resources in your hand.",
		"type_code": "treachery"
	},
	{
		"boost": 1,
		"code": "201522",
		"faction_code": "encounter",
		"name": "Veiled Ambush",
		"octgn_id": "a4082154-3c42-520c-ade7-5ee1ec000022",
		"pack_code": "ms_marvel_by_cptscorp_&_rycoran",
		"position": 18,
		"quantity": 1,
		"set_code": "ms_marvel_by_cptscorp_&_rycoran_nemesis",
		"set_position": 5,
		"text": "<b>When Revealed (Alter-Ego)</b>: The villain schemes. Place 1 threat on each side scheme.\n<b>When Revealed (Hero)</b>: The villain attacks you. Place 1 threat on each \tside scheme.",
		"type_code": "treachery"
	}
]
