[
	{
		"code": "205801b",
		"faction_code": "hero",
		"flavor": "“I'm going to stand side by side with you to protect our right to live in this world.”",
		"hand_size": 6,
		"health": 10,
		"hidden": true,
		"is_unique": true,
		"name": "Angelica Jones",
		"octgn_id": "616b40dd-052c-455d-a2bd-fc8b47058001",
		"pack_code": "firestar_by_bluehg",
		"position": 1,
		"quantity": 1,
		"recover": 3,
		"set_code": "firestar_by_bluehg",
		"text": "<i>Schooling for the Gifted</i> — <b>Action</b>: Put a card from your discard pile on top of your deck. (Limit once per round.)",
		"traits": "Mutant.",
		"type_code": "alter_ego"
	},
	{
		"attack": 2,
		"attack_star": true,
		"back_link": "205801b",
		"code": "205801a",
		"defense": 1,
		"defense_star": true,
		"faction_code": "hero",
		"hand_size": 5,
		"health": 10,
		"is_unique": true,
		"meta": {
			"colors": [
				"#e8c136",
				"#ffffff",
				"#e8c136",
				"#cc262a"
			]
		},
		"name": "Firestar",
		"octgn_id": "616b40dd-052c-455d-a2bd-fc8b47058001",
		"pack_code": "firestar_by_bluehg",
		"position": 1,
		"quantity": 1,
		"set_code": "firestar_by_bluehg",
		"text": "[star] <i>Supercharge</i> — <b>Interrupt</b>: When you use a basic power, discard up to 4 cards from the top of your deck → if at least 1 [energy] or [wild] resource was discarded this way, you get +1 to that basic power for this use. (Limit once per phase.)",
		"thwart": 1,
		"thwart_star": true,
		"traits": "X-Men.",
		"type_code": "hero"
	},
	{
		"attack": 3,
		"attack_cost": 2,
		"attack_star": true,
		"code": "205802",
		"cost": 3,
		"deck_limit": 1,
		"faction_code": "hero",
		"flavor": "“I'm not giving up, Angelica.”",
		"health": 3,
		"is_unique": true,
		"name": "Justice",
		"octgn_id": "616b40dd-052c-455d-a2bd-fc8b47058002",
		"pack_code": "firestar_by_bluehg",
		"position": 2,
		"quantity": 1,
		"resource_mental": 1,
		"set_code": "firestar_by_bluehg",
		"set_position": 1,
		"text": "[star] <b>Response</b>: After Justice uses a basic power, put an identity-specific card from your discard pile on top of your deck.",
		"thwart": 1,
		"thwart_cost": 1,
		"thwart_star": true,
		"traits": "Avenger.",
		"type_code": "ally"
	},
	{
		"code": "205803",
		"cost": 3,
		"deck_limit": 3,
		"faction_code": "hero",
		"name": "Microwave Blast",
		"octgn_id": "616b40dd-052c-455d-a2bd-fc8b47058003",
		"pack_code": "firestar_by_bluehg",
		"position": 3,
		"quantity": 3,
		"resource_physical": 1,
		"set_code": "firestar_by_bluehg",
		"set_position": 2,
		"text": "<b>Hero Action</b> <i>(attack)</i>: Deal 5 damage to an enemy. Discard up to 4 cards from the top of your deck. For each [energy] or [wild] resource discarded as a part of this effect, this attack deals 1 additional damage. If 3 or more [energy] or [wild] icons were discarded, deal 1 damage to each minion engaged with you.",
		"traits": "Attack. Superpower.",
		"type_code": "event"
	},
	{
		"code": "205804",
		"cost": 2,
		"deck_limit": 2,
		"faction_code": "hero",
		"flavor": "“I got this.”",
		"name": "Radiative Vision",
		"octgn_id": "616b40dd-052c-455d-a2bd-fc8b47058004",
		"pack_code": "firestar_by_bluehg",
		"position": 4,
		"quantity": 2,
		"resource_mental": 1,
		"set_code": "firestar_by_bluehg",
		"set_position": 5,
		"text": "<b>Hero Action</b> <i>(thwart)</i>: Remove 3 threat from a scheme. Discard up to 4 cards from the top of your deck. For each [energy] or [wild] resource discarded this way, remove 1 threat from a scheme.",
		"traits": "Superpower. Thwart.",
		"type_code": "event"
	},
	{
		"code": "205805",
		"deck_limit": 3,
		"faction_code": "hero",
		"name": "Ambient Microwaves",
		"octgn_id": "616b40dd-052c-455d-a2bd-fc8b47058005",
		"pack_code": "firestar_by_bluehg",
		"position": 5,
		"quantity": 3,
		"resource_energy": 2,
		"set_code": "firestar_by_bluehg",
		"set_position": 7,
		"text": "<b>Interrupt</b>: When you spend this card, shuffle it into your deck instead of discarding it.\n<b>Hero Response</b>: After this card is discarded from the top of your deck, ready Firestar.",
		"type_code": "resource"
	},
	{
		"code": "205806",
		"cost": 1,
		"deck_limit": 2,
		"faction_code": "hero",
		"name": "Clandestine Operative",
		"octgn_id": "616b40dd-052c-455d-a2bd-fc8b47058006",
		"pack_code": "firestar_by_bluehg",
		"position": 6,
		"quantity": 2,
		"resource_energy": 1,
		"set_code": "firestar_by_bluehg",
		"set_position": 10,
		"text": "Max 1 per player.\nFirestar gets +1 THW.\n<b>Forced Response</b>: After Firestar attacks, discard up to 4 cards from the top of your deck. For each [energy] or [wild] resource discarded this way, deal 1 damage to an enemy or remove 1 threat from a scheme. Discard Clandestine Operative.",
		"traits": "Tactic.",
		"type_code": "upgrade"
	},
	{
		"code": "205807",
		"cost": 1,
		"deck_limit": 1,
		"faction_code": "hero",
		"name": "Once an Avenger...",
		"octgn_id": "616b40dd-052c-455d-a2bd-fc8b47058007",
		"pack_code": "firestar_by_bluehg",
		"position": 7,
		"quantity": 1,
		"resource_energy": 1,
		"set_code": "firestar_by_bluehg",
		"set_position": 12,
		"text": "Firestar gains the [[AVENGER]] trait.\n<b>Hero Interrupt</b>: After you defeat an enemy or a scheme, exhaust Once an Avenger... → put a resource card from your discard pile on top of your deck.",
		"traits": "Title.",
		"type_code": "upgrade"
	},
	{
		"code": "205808",
		"cost": 2,
		"deck_limit": 1,
		"faction_code": "hero",
		"name": "Plasma Propulsion",
		"octgn_id": "616b40dd-052c-455d-a2bd-fc8b47058008",
		"pack_code": "firestar_by_bluehg",
		"position": 8,
		"quantity": 1,
		"resource_physical": 1,
		"set_code": "firestar_by_bluehg",
		"set_position": 13,
		"text": "Firestar gets +1 DEF and gains retaliate 1 and the [[AERIAL]] trait.\n<b>Hero Interrupt</b>: When you would discard cards from the top of your deck, exhaust Plasma Propulsion → you may discard up to 2 additional cards from the top of your deck.",
		"traits": "Superpower.",
		"type_code": "upgrade"
	},
	{
		"code": "205809",
		"cost": 2,
		"deck_limit": 1,
		"faction_code": "hero",
		"name": "Solar Surge",
		"octgn_id": "616b40dd-052c-455d-a2bd-fc8b47058009",
		"pack_code": "firestar_by_bluehg",
		"position": 9,
		"quantity": 1,
		"resource_mental": 1,
		"set_code": "firestar_by_bluehg",
		"set_position": 14,
		"text": "<b>Hero Interrupt</b>: When you use Firestar's \"Supercharge\" ability, if you discard at least 1 [energy] and/or [wild] resource, you get an additional +1 to the chosen basic power for this use.",
		"traits": "Superpower.",
		"type_code": "upgrade"
	},
	{
		"code": "205810",
		"cost": 3,
		"deck_limit": 1,
		"faction_code": "hero",
		"name": "Stellar Aura",
		"octgn_id": "616b40dd-052c-455d-a2bd-fc8b47058010",
		"pack_code": "firestar_by_bluehg",
		"position": 10,
		"quantity": 1,
		"resource_mental": 1,
		"set_code": "firestar_by_bluehg",
		"set_position": 15,
		"text": "<b>Hero Resource</b>: Exhaust Stellar Aura → generate the resources of the top resource card in your discard pile. Then, put that resource card on the bottom of your deck.",
		"traits": "Superpower.",
		"type_code": "upgrade"
	}
]
