[
	{
		"code": "57032",
		"cost": 1,
		"faction_code": "basic",
		"name": "You're Out of Order!",
		"octgn_id": "2b778323-b4d9-4567-999d-42e7de057032",
		"pack_code": "synthezoid",
		"position": 32,
		"quantity": 1,
		"resource_wild": 1,
		"set_code": "she_hulk_leader",
		"text": "<b>Interrupt</b>: When any amount of threat would be placed on the main scheme, say \"I object!\" and prevent 3 of that threat.",
		"type_code": "event"
	},
	{
		"code": "57033",
		"cost": 2,
		"faction_code": "basic",
		"flavor": "\"That does it! Now I'm mad!\" —She-Hulk",
		"name": "She-Hulk Smash",
		"octgn_id": "2b778323-b4d9-4567-999d-42e7de057033",
		"pack_code": "synthezoid",
		"position": 33,
		"quantity": 1,
		"resource_wild": 1,
		"set_code": "she_hulk_leader",
		"text": "<b>Action</b>: Your She-Hulk leader attacks the enemy leader. If you spent a [physical] resource to pay for this event, stun the enemy leader.",
		"type_code": "event"
	},
	{
		"code": "57034",
		"cost": 1,
		"faction_code": "basic",
		"name": "Make Me Angry",
		"octgn_id": "2b778323-b4d9-4567-999d-42e7de057034",
		"pack_code": "synthezoid",
		"position": 34,
		"quantity": 1,
		"resource_physical": 1,
		"set_code": "she_hulk_leader",
		"text": "Attach to your She-Hulk leader.\n<b>Forced Response</b>: After a hero or leader attacks attached She-Hulk, she attacks that character. Then, discard this card.",
		"type_code": "upgrade"
	},
	{
		"code": "57035",
		"faction_code": "basic",
		"name": "Legal Counsel",
		"octgn_id": "2b778323-b4d9-4567-999d-42e7de057035",
		"pack_code": "synthezoid",
		"position": 35,
		"quantity": 1,
		"resource_wild": 2,
		"set_code": "she_hulk_leader",
		"text": "<b>Hero Response</b>: After you spend this resource, move 1 threat from the main scheme to your leader's main scheme.",
		"type_code": "resource"
	},
	{
		"code": "57074",
		"cost": 2,
		"faction_code": "basic",
		"flavor": "\"There is no victory without risk.\" —Vision",
		"name": "Calculated Risk",
		"octgn_id": "2b778323-b4d9-4567-999d-42e7de057074",
		"pack_code": "synthezoid",
		"position": 74,
		"quantity": 1,
		"resource_wild": 1,
		"set_code": "vision_leader",
		"text": "<b>Action</b>: Search the top 5 cards of your leader's encounter deck for an encounter card and deal it to the first player on the enemy team as a facedown encounter card.",
		"type_code": "event"
	},
	{
		"code": "57075",
		"cost": 2,
		"faction_code": "basic",
		"name": "Synthezoid Strike",
		"octgn_id": "2b778323-b4d9-4567-999d-42e7de057075",
		"pack_code": "synthezoid",
		"position": 75,
		"quantity": 1,
		"resource_wild": 1,
		"set_code": "vision_leader",
		"text": "<b>Action</b>: Your Vision leader attacks the enemy leader. If Vision's mass form attachment is:\n• Dense, Vision gets +1 ATK for this attack and this attack gains piercing.\n• Intangible, flip it to Dense before resolving this attack.",
		"type_code": "event"
	},
	{
		"code": "57076",
		"errata": "Changed “Hero Interrupt” to “Hero Action”. (RRG 1.8)",
		"cost": 0,
		"faction_code": "basic",
		"flavor": "\"My ability to phase through electronics can disrupt Stark's technology.\" —Vision",
		"name": "Phased Out",
		"octgn_id": "2b778323-b4d9-4567-999d-42e7de057076",
		"pack_code": "synthezoid",
		"position": 76,
		"quantity": 1,
		"resource_wild": 1,
		"set_code": "vision_leader",
		"text": "<b>Action</b>: Choose an attachment on the enemy leader with the text <b>\"Hero Response\"</b> or <b>\"Hero Action\"</b> and discard it.",
		"type_code": "event"
	},
	{
		"code": "57077",
		"faction_code": "basic",
		"name": "Android Assistance",
		"octgn_id": "2b778323-b4d9-4567-999d-42e7de057077",
		"pack_code": "synthezoid",
		"position": 77,
		"quantity": 1,
		"resource_wild": 2,
		"set_code": "vision_leader",
		"text": "<b>Hero Interrupt</b>: When you spend this resource, flip your Vision leader's mass form attachment.",
		"type_code": "resource"
	}
]
